stock_id,stock_name,position_action,position_reason,position_hint,take_profit_hint,chip_hint,risk_flag,avg_price,shares,lots,close,ma5,ma20,ma5_status,ma20_status,pnl_pct,chip_score,chip_label,chip_reason,price_source,chip_source,position_source,updated_at
2317,nan,🟡 觀察,跌破五日線，短線動能轉弱。,短線先觀察，不建議追高加碼。,若已有獲利，可先分批停利；若籌碼仍集中可留部分觀察。,籌碼偏集中，仍有資金支撐；若短線未轉弱，可續抱觀察。,BELOW_MA5,229.0,1000.0,1.0,219.5,223.9,209.8,MA5：貼近｜→ 盤整,MA20：站上｜↑ 強勢,-4.15,70.0,🟢 偏集中,三大法人買超｜外資買超｜投信賣超｜自營商買超,price_panel_daily.csv + feature_panel_daily.csv,chip_source_twse.csv,manual_positions.csv,2026-05-04 03:42:57
2330,nan,🟠 停利觀察,獲利已達 310.58%，但短線或籌碼出現轉弱跡象。,建議分批停利，保留部分部位觀察。,高獲利區出現轉弱，不要把獲利全部吐回去，先收一部分。,籌碼偏分散，資金共識不足；若跌破五日線或 MA20，建議減碼控風險。,TAKE_PROFIT_20_WEAK,520.0,1000.0,1.0,2135.0,2196.0,2042.75,MA5：跌破｜↓ 轉弱,MA20：站上｜↑ 強勢,310.58,34.0,⚠️ 分散,三大法人賣超｜外資賣超｜投信買超｜自營商買超,price_panel_daily.csv + feature_panel_daily.csv,chip_source_twse.csv,manual_positions.csv,2026-05-04 03:42:57
2409,nan,🔴 出場,觸發停損 -9.47%，優先保護本金。,優先處理賣出，不建議拖延或凹單。,目前不是停利情境，而是停損風控。,籌碼極度分散，續抱信心低；若有獲利優先停利，若虧損則嚴格控風險。,STOP_LOSS,19.0,3000.0,3.0,17.2,17.25,18.105,MA5：貼近｜→ 盤整,MA20：跌破｜↓ 轉弱,-9.47,14.0,❌ 極度分散,三大法人賣超｜外資賣超｜投信賣超｜自營商買超,price_panel_daily.csv + feature_panel_daily.csv,chip_source_twse.csv,manual_positions.csv,2026-05-04 03:42:57
3051,nan,🟢 抱住,獲利已達 49.21%，且短線與籌碼尚未明顯轉弱。,續抱，但必須用五日線或移動停利保護獲利。,已進入高獲利區，若跌破五日線或籌碼轉弱，優先分批停利。,籌碼偏集中，仍有資金支撐；若短線未轉弱，可續抱觀察。,PROFIT_STRONG_HOLD,19.0,2000.0,2.0,28.35,25.91,22.465,MA5：站上｜↑ 強勢,MA20：站上｜↑ 強勢,49.21,78.0,🟢 偏集中,三大法人買超｜外資買超,price_panel_daily.csv + feature_panel_daily.csv,chip_source_twse.csv,manual_positions.csv,2026-05-04 03:42:57
3583,nan,🟢 抱住,尚未出現明顯下跌或系統賣出訊號，趨勢未完全破壞。,在還沒有明顯下跌、未觸發風控前，以續抱觀察為主。,尚未達明確停利條件，先依趨勢與籌碼續抱觀察。,籌碼偏分散，資金共識不足；若跌破五日線或 MA20，建議減碼控風險。,HOLD_CHECK,800.0,300.0,0.3,792.0,770.6,699.75,MA5：站上｜↑ 強勢,MA20：站上｜↑ 強勢,-1.0,34.0,⚠️ 分散,三大法人賣超｜外資賣超｜投信買超｜自營商買超,price_panel_daily.csv + feature_panel_daily.csv,chip_source_twse.csv,manual_positions.csv,2026-05-04 03:42:57
